{
  "id": "sunken_archive",
  "title": "The Sunken Archive",
  "theme": "Classic dungeon crawl",
  "openingNarrative": "You wake on stone. Cold, damp, and wrong — the kind of cold that means you're underground and have been for a while. Behind you, the stairway is a wall of rubble. Your oil lamp sits beside you, flame low but stubborn. Ahead, a vaulted corridor exhales stale air that tastes of copper and old paper. Water pools in the cracks between flagstones, and somewhere ahead, something drips with metronomic patience. You don't remember coming down here. The Archive remembers you.",
  "startLocationId": "antechamber",
  "startInventory": ["oil_lamp"],
  "locations": [
    {
      "id": "antechamber",
      "name": "The Antechamber",
      "description": "Collapsed stairway, rubble blocks exit upward. Floor mosaic: open book in chains. Water seeps through debris. One corridor leads north to Main Hall. The Codex Umbra can unseal the stairway exit.",
      "keywords": ["antechamber", "start", "entrance", "stairway", "rubble"],
      "atmosphere": "Claustrophobic, silent",
      "exits": [
        {
          "direction": "north",
          "targetLocationId": "main_hall"
        },
        {
          "direction": "up",
          "targetLocationId": "surface",
          "blocked": true,
          "blockedBy": "Collapsed stairway sealed by rubble — only the Codex Umbra can unseal it",
          "requiredFlag": "codex_taken"
        }
      ],
      "itemIds": [],
      "npcIds": []
    },
    {
      "id": "east_wing",
      "name": "The East Wing",
      "description": "Ankle-deep dark water. Leaning bookshelves, waterlogged books. Collapsed reading desk with metallic glint underneath. Water flows north. One readable shelf mentions the Cipher for Restricted texts. Exits: west to Main Hall, north to Flooded Passage.",
      "keywords": ["east wing", "waterlogged", "stacks", "shelves", "desk"],
      "atmosphere": "Ruined, melancholy",
      "exits": [
        {
          "direction": "west",
          "targetLocationId": "main_hall"
        },
        {
          "direction": "north",
          "targetLocationId": "flooded_passage"
        }
      ],
      "itemIds": ["brass_key"],
      "npcIds": []
    },
    {
      "id": "main_hall",
      "name": "The Main Hall",
      "description": "Central vaulted corridor. Bioluminescent fungus on ceiling casts blue-green glow, reacts to loud sounds. Floor mosaic shows robed figures carrying books into a spiral. Water stream flows south. Exits: south, east, west, north.",
      "keywords": ["main hall", "corridor", "mosaic", "fungus", "hub"],
      "atmosphere": "Grand decay, underwater feeling",
      "exits": [
        {
          "direction": "south",
          "targetLocationId": "antechamber"
        },
        {
          "direction": "east",
          "targetLocationId": "east_wing"
        },
        {
          "direction": "west",
          "targetLocationId": "west_wing"
        },
        {
          "direction": "north",
          "targetLocationId": "circulation_desk"
        }
      ],
      "itemIds": [],
      "npcIds": []
    },
    {
      "id": "west_wing",
      "name": "The West Wing",
      "description": "Bone-dry, warm air. Glass display cases, most shattered. One intact case with wax seal holds the Archivist's Journal. Cabinet drawer contains glass vial of solvent. Ceiling timbers creak. Exit: east to Main Hall.",
      "keywords": ["west wing", "display case", "manuscripts", "dry", "rare"],
      "atmosphere": "Hushed, museum-like",
      "exits": [
        {
          "direction": "east",
          "targetLocationId": "main_hall"
        }
      ],
      "itemIds": ["archivists_journal", "glass_vial_solvent"],
      "npcIds": []
    },
    {
      "id": "flooded_passage",
      "name": "The Flooded Passage",
      "description": "Waist-deep black water, narrow walls, low ceiling. Sound distorts. Waterproof satchel on peg above water. Submerged shelf holds sealed lamp oil. Visible high-water mark above current level. Exits: south to East Wing, west to Circulation Desk.",
      "keywords": ["flooded passage", "waist-deep", "water", "dark water", "passage"],
      "atmosphere": "Primal fear, vulnerability",
      "exits": [
        {
          "direction": "south",
          "targetLocationId": "east_wing"
        },
        {
          "direction": "west",
          "targetLocationId": "circulation_desk"
        }
      ],
      "itemIds": ["waterproof_satchel"],
      "npcIds": []
    },
    {
      "id": "circulation_desk",
      "name": "The Circulation Desk",
      "description": "Hexagonal chamber with massive stone desk. Chained leather ledger. Polished brass bell summons the Cataloger. Iron gate north to Restricted Section needs brass key. Exits: south, east, west, north (locked).",
      "keywords": ["circulation desk", "desk", "ledger", "bell", "catalog"],
      "atmosphere": "Bureaucratic order amid chaos",
      "exits": [
        {
          "direction": "south",
          "targetLocationId": "main_hall"
        },
        {
          "direction": "east",
          "targetLocationId": "flooded_passage"
        },
        {
          "direction": "west",
          "targetLocationId": "reading_room"
        },
        {
          "direction": "north",
          "targetLocationId": "restricted_section",
          "blocked": true,
          "blockedBy": "Iron gate locked — requires the Brass Key or Cataloger bypass with Archivist's Journal",
          "requiredFlag": "gate_opened"
        }
      ],
      "itemIds": [],
      "npcIds": ["the_cataloger"]
    },
    {
      "id": "reading_room",
      "name": "The Reading Room",
      "description": "Large domed chamber. Star map mural — constellations subtly wrong. Collapsed tables and chairs. Cold stone fire pit with oversized scorch marks forming Archive seal. Cipher Wheel hidden in hollowed book near fire pit. Exits: east, south.",
      "keywords": ["reading room", "mural", "dome", "constellations", "firepit"],
      "atmosphere": "Vast, echoing, exposed",
      "exits": [
        {
          "direction": "east",
          "targetLocationId": "circulation_desk"
        },
        {
          "direction": "south",
          "targetLocationId": "west_wing"
        }
      ],
      "itemIds": ["cipher_wheel"],
      "npcIds": ["maren"]
    },
    {
      "id": "restricted_section",
      "name": "The Restricted Section",
      "description": "Carved from bedrock. Books chained to shelves, spines inward. Air thick and warm. Darkness unnaturally dense. Low hum from below. One scorched shelf — Codex Umbra's original location. The Warden manifests near spiral staircase. Exits: south, down (after Warden).",
      "keywords": ["restricted section", "chained books", "chains", "iron gate", "warden"],
      "atmosphere": "Oppressive, sacred, dangerous",
      "exits": [
        {
          "direction": "south",
          "targetLocationId": "circulation_desk"
        },
        {
          "direction": "down",
          "targetLocationId": "vault_of_the_codex",
          "blocked": true,
          "blockedBy": "The Warden guards the spiral staircase — must pass its test",
          "requiredFlag": "warden_passed"
        }
      ],
      "itemIds": [],
      "npcIds": ["the_warden"]
    },
    {
      "id": "vault_of_the_codex",
      "name": "The Vault of the Codex",
      "description": "Circular obsidian chamber. Stone pedestal holds Codex Umbra — black leather book absorbing light. Five-disc combination lock with star-map symbols. Taking Codex triggers flooding. Pedestal engraving matches Antechamber seal. Exit: up to Restricted Section.",
      "keywords": ["vault", "codex", "pedestal", "seal", "final"],
      "atmosphere": "Finality, awe",
      "exits": [
        {
          "direction": "up",
          "targetLocationId": "restricted_section"
        }
      ],
      "itemIds": [],
      "npcIds": []
    }
  ],
  "items": [
    {
      "id": "oil_lamp",
      "name": "Oil Lamp",
      "description": "Player's starting item. Illuminates locations. Reveals hidden text on manuscripts and star map when held close. Finite oil — refuelable from Flooded Passage jar. Dims in Act III if not refueled.",
      "keywords": ["lamp", "oil lamp", "light"],
      "foundLocationId": "antechamber",
      "isStartingItem": true,
      "consumable": false,
      "interactions": [
        {
          "target": "west_wing",
          "effect": "Holding lamp close to display case reveals hidden UV-reactive text on the Archivist's Journal"
        },
        {
          "target": "reading_room",
          "effect": "Holding lamp overhead makes star map symbols glow, revealing the 5-symbol pedestal combination",
          "setsFlag": "star_map_read"
        }
      ]
    },
    {
      "id": "brass_key",
      "name": "Brass Key",
      "description": "Found under collapsed desk in East Wing. Opens iron gate to Restricted Section. Single use — breaks in lock. Archive seal on bow. Tagged 'Restricted — Return to Desk.'",
      "keywords": ["brass key", "key", "metallic glint"],
      "foundLocationId": "east_wing",
      "isStartingItem": false,
      "consumable": true,
      "interactions": [
        {
          "target": "circulation_desk",
          "effect": "Unlocks the iron gate to the Restricted Section with a groan of old metal. The key breaks off in the lock.",
          "setsFlag": "gate_opened",
          "consumesItem": true
        },
        {
          "target": "the_cataloger",
          "effect": "The Cataloger recognizes the key and remarks it should have been destroyed after the Incident.",
          "setsFlag": "cataloger_key_comment"
        }
      ]
    },
    {
      "id": "archivists_journal",
      "name": "Archivist's Journal",